function_id,attempt,response_text,sas_score
tier1_001_update,1.0,This function updates the screen by replacing or updating the rendered content and style of a console output.,
tier1_002_initialize,1.0,This function initializes the IOLoop by setting it as the current event loop if the `make_current` parameter is set to `True`.,
tier1_003_headers,1.0,"This function sets the default headers for an HTTP request, including Accept, Accept-Encoding, Connection, and User-Agent, and then updates these headers with any additional ones provided in the `headers` parameter.",
tier1_004_collect,1.0,"This function, part of the Pytest testing framework, collects fixtures (setup and teardown functions) for a test session.",
tier1_005_start,1.0,"This function is intended to be overridden by subclasses and starts the I/O loop, which runs indefinitely until it's stopped by a call to `stop()`.",
tier1_006__like_percent_literal,1.0,"This function generates a SQL literal that represents the wildcard character '%' in a LIKE query, surrounded by single quotes.",
tier1_007_api_route,1.0,"This function is a decorator factory that creates a route for an API endpoint, allowing developers to customize various aspects of the route, such as its path, response model, and status code.",
tier1_008__is_clean,1.0,"This function checks if an object's identity map is clean, meaning it has not been modified or deleted.",
tier1_009_visit_drop_column_comment,1.0,This function generates a SQL statement to drop the comment on a specific column in a database table.,
tier1_010_raw_connection,1.0,"This function returns a ""raw"" DBAPI connection from the connection pool, providing direct access to the underlying database connection for special situations where the API provided by the `Connection` object is not needed.",
tier1_011_grid,1.0,"This function creates a table with no lines, headers, or footer, allowing for customization of padding and edge settings.",
tier1_012___bool__,1.0,This function returns a boolean value indicating whether the span or range object it is part of has an end position greater than its start position.,
tier1_013_visit_regexp_replace_op_binary,1.0,This function raises a CompileError exception when attempting to compile a SQL query with a binary regular expression replacement operation that is not supported by the specified dialect.,
tier1_014_add_future,1.0,This function schedules a callback to be executed when a given asynchronous operation (represented by a Future object) completes.,
tier1_015_get_schema_from_ref,1.0,This function retrieves a Pydantic schema definition by its reference string.,
tier1_016_render_embed_js,1.0,"This function generates and returns a JavaScript string that embeds the provided JavaScript code, wrapping it in a script tag with a CDATA section.",
tier1_017___init__,1.0,"This function initializes a new instance of an HTTP client class, setting the initial request and default parameters for future operations.",
tier1_018_closed,1.0,This function checks whether a database connection is closed by verifying that the underlying database API connection is `None` and that reconnecting is not possible.,
tier1_019__expire_state,1.0,"This function is responsible for expiring the state of an object in a SQLAlchemy session, which involves removing its attributes and re-fetching associated objects to maintain consistency with the session's current state.",
tier1_020_render,1.0,"This function generates and returns the HTML for an XSRF (Cross-Site Request Forgery) form, which is a security measure to prevent malicious scripts from making unauthorized requests on behalf of a user.",
tier1_021__rget_with_confmod,1.0,This function retrieves a module and its attribute from the configuration files specified by the provided path.,
tier1_022_define_constraint_cascades,1.0,"This function generates a SQL string that defines the cascading behavior for a given ForeignKeyConstraint, including ondelete and onupdate actions.",
tier1_023_from_call,1.0,"This function, `from_call`, wraps the execution of a given function (`func`) in a structured way, collecting information about the call's timing, phase, and any exceptions that may be raised, and returns an instance of `CallInfo` containing this information.",
tier1_024_copy,1.0,"This function creates a deep copy of the given `Text` instance, copying all its attributes and references to ensure that any modifications made to the copied instance do not affect the original.",
tier1_025_get_version,1.0,"This function generates a version string for a static asset based on its absolute file path, which is used in static URLs.",
tier2_001___init__,1.0,"This function initializes a new Connection object, which is used to establish a connection to a database, and sets various attributes related to the connection, such as the dialect, transaction management, and event handling.",
tier2_002_get,1.0,"This function generates a ""row"" that represents the primary key of an INSERT operation, either by using the provided `lastrowid` value or extracting values from the parameters used for the INSERT.",
tier2_003__set_initial_conftests,1.0,"This function loads initial conftest files given a preparsed ""namespace"" by iterating through the provided paths, checking if they are anchors or exist, and attempting to load their corresponding conftest files.",
tier2_004_flush,1.0,"This function flushes the current output buffer to the network, ensuring that all headers and data are sent to the client before closing the connection.",
tier2_005__connect_and_send_request,1.0,"This function establishes a connection to the specified host and sends an HTTP request, handling potential timeouts, protocol settings, and response parsing.",
tier2_006__available_connections,1.0,"This function calculates the number of available connections, taking into account a global limit, a per-host limit, and any previously acquired connections for a given connection key.",
tier2_007_ensure_multipart_is_installed,1.0,"This function checks if the `python_multipart` or `multipart` library is installed and its version meets a minimum requirement, raising an error if either library is not installed or its version is too old.",
tier2_008_call_and_report,1.0,"This function is responsible for executing a test hook (setup, call, or teardown) and reporting the result of the test execution.",
tier2_009_get_identity_options,1.0,"This function generates a SQL string that defines the identity options for an auto-incrementing column, including settings such as increment value, starting value, minimum and maximum values, caching, and cycling.",
tier2_010_send_error,1.0,"This function sends an HTTP error response to the browser with a specified status code and optional reason message, overriding any previously written output and potentially terminating the response.",
tier2_011__traceback_filter,1.0,"This function filters and formats the traceback information from an exception, potentially removing unnecessary details or modifying its style according to the test configuration.",
tier2_012_render_lines,1.0,"This function renders a given `renderable` object into a list of lines, where each line is a list of segments, and optionally applies a specified style to the rendered text.",
tier2_013___init__,1.0,"This function initializes a new instance of the `Compiled` class, which is used to compile SQL statements against a specific dialect and schema translate map, and sets various internal state variables based on the provided parameters.",
tier2_014_visit_override_binds,1.0,"This function is used to compile and modify the SQL statement of an _OverrideBinds object, which contains bind parameters that need to be swapped out at execution time.",
tier2_015_task,1.0,"This function is a decorator that creates a task class out of any callable, allowing it to be used with Celery's task queue system.",
tier2_016__get_proxy_map,1.0,"This function generates a dictionary mapping all available proxies to the specified proxy, either from environment variables or a provided proxy URL.",
tier2_017_collect,1.0,"This function, part of the pytest framework, filters out test classes that have an __init__ or __new__ constructor and instead collects fixtures for those classes.",
tier2_018___init__,1.0,"This function initializes a test case object in the Pytest framework, setting various attributes such as the test name, parent node, and configuration, while also handling fixtures, callspecs, and markers.",
tier2_019__get_plugin_specs_as_list,1.0,"This function takes a plugins specification (which can be an empty value, a module name, a comma-separated list of plugin names, or a direct list of plugin names) and returns it as a list of plugin names in a format that can be used by the pytest testing framework.",
tier2_020__prepareconfig,1.0,This function prepares and returns a configuration object for the pytest testing framework by parsing command-line arguments and plugins.,
tier2_021__inserted_primary_key_from_returning_get,1.0,This function generates a custom function that can be used to retrieve the inserted primary key values from an INSERT statement with an explicit RETURNING clause.,
tier2_022_get_column_specification,1.0,"This function generates a string representation of the column specification for a given SQLAlchemy Column object, including its data type, default value, computed columns, and identity constraints.",
tier2_023__release,1.0,"This function releases a connection from the connector, which involves closing any associated transport and updating internal state to handle future connections.",
tier2_024_etag,1.0,"This function sets the ETag header in an HTTP response based on the provided value, which can be a string, an ETag object, or None, and validates its format according to the HTTP specification.",
tier2_025_render,1.0,"This function renders a given object into an iterable of `Segment` instances according to the console protocol, handling various types of objects and options.",
tier3_001_visit_function,1.0,"This function generates a SQL string representation of a given Python function, including its name and any arguments it takes.",
tier3_002__collapse_widths,1.0,This function reduces the widths of columns in a table to fit within a specified maximum width while allowing some columns to potentially shrink if they are wrapable.,
tier3_003_visit_compound_select,1.0,"This function generates the SQL code for a compound select statement, which is a SELECT statement that combines multiple sub-queries or other SELECT statements.",
tier3_004_request_params_to_args,1.0,"This function takes in a list of model fields and received parameters (which can be query parameters, headers, or multidict), extracts the relevant values from the received parameters, validates them against the model fields, and returns a dictionary of validated values and any validation errors.",
tier3_005__arguments_schema,1.0,"This function generates a schema for the arguments of a Python function, including support for positional-only parameters, variable-length argument lists, and keyword-only parameters with typed dictionaries.",
tier3_006__register_persistent,1.0,"This function registers all persistent objects from a flush operation in an ORM session, handling object identity key updates and ensuring consistency with the database.",
tier3_007_visit_column,1.0,"This function generates a SQL column reference string based on the provided column object and various optional parameters, including table names, aliases, and result mapping.",
tier3_008___init__,1.0,"This function initializes a Celery application object, setting up various attributes such as task classes, logging, and configuration options, while also registering the app with Celery's internal framework.",
tier3_009__enum_schema,1.0,"This function generates a JSON schema for an enumeration type in Pydantic, allowing it to be used in serialization and validation processes.",
tier3_010_merge_field_infos,1.0,"This function merges multiple `FieldInfo` instances into a single instance, keeping only explicitly set attributes and overriding earlier ones with later ones.",
tier3_011_find_spec,1.0,"This function is part of a testing framework and is used to find the specification for a given module or file, taking into account various factors such as rewriting rules, import modes, and file existence.",
tier3_012_parse,1.0,"This function parses the given command-line arguments into a configuration object for pytest, allowing it to be used as a base for further configuration and plugin loading.",
tier3_013__get_assertion_exprs,1.0,"This function takes a source code string as input, parses it to extract assertion test expressions from the code, and returns a dictionary mapping line numbers to their corresponding assertion test expressions.",
tier3_014_size,1.0,"This function retrieves the size of a console, taking into account various factors such as terminal type, environment variables, and pseudo-terminals, to return a named tuple containing the dimensions.",
tier3_015__getini_ini,1.0,"This function is used to parse and coerce configuration values read in INI mode, handling different data types such as strings, lists, integers, floats, and booleans.",
tier3_016_visit_table,1.0,"This function generates a string representation of a database table name, taking into account various factors such as schema usage, aliasing, and hints.",
tier3_017_update,1.0,"This function updates the settings of a console object by allowing certain parameters to be set or left unchanged, and returns a copy of the updated console object.",
tier3_018__collect_renderables,1.0,"This function collects and combines various types of renderable objects (such as text, emojis, markup, and console output) into a single list of ConsoleRenderable objects that can be rendered together.",
tier3_019_get_dependant,1.0,"This function generates a dependency object for a given FastAPI endpoint by analyzing its signature and dependencies, including OAuth scopes and parameter details.",
tier3_020___init__,1.0,"This function initializes a Pydantic field with various attributes and settings, such as default value, alias, validation rules, serialization options, and metadata.",
tier3_021_export_svg,1.0,"This function generates an SVG image from the contents of a console, using the Rich library's styling capabilities to create a visually appealing representation of the terminal output.",
tier3_022_visit_Assert,1.0,"This function rewrites a given Python `assert` statement into a more detailed and informative version that raises an `AssertionError` exception if the assertion fails, providing explanations for the error.",
tier3_023__apply_single_annotation,1.0,"This function applies a given metadata object to a Pydantic schema, updating the schema as necessary based on the metadata's attributes and relationships with other schemas.",
tier3_024__resolve_host,1.0,"This function resolves a host and returns a list of addresses, using caching and throttling to optimize DNS lookups.",
tier3_025_http_range,1.0,This function parses the Range HTTP header from an aiohttp request and returns a slice object representing the requested portion of the content.,
tier4_001___init__,1.0,"This function initializes a FastAPI API route, setting various attributes such as the endpoint, response model, status code, and dependencies, which are used to define the behavior of the route.",
tier4_002_render,1.0,"This function renders console markup into a Text instance, allowing for styling and formatting of text with tags, emojis, and other features.",
tier4_003__request,1.0,This function sends an HTTP request to a specified URL using the aiohttp library and returns a response object.,
tier4_004___init__,1.0,"This function initializes a console object, setting various attributes and options for rendering text in a terminal or other output environment.",
tier4_005_visit_cte,1.0,"This function is part of a SQL compiler and is responsible for handling Common Table Expressions (CTEs) in SQL queries, including checking for duplicate CTEs with the same name, resolving aliases, and generating the final compiled text for the CTE.",
tier4_006_visit_bindparam,1.0,"This function is part of a SQL compiler and is responsible for processing bind parameters, which are placeholders in SQL queries that are replaced with actual values at execution time. It handles various scenarios such as detecting parametrized bindparams in upsert SET clauses, rendering literal bindparam expressions, and handling conflicts between bind parameter names.",
tier4_007_include_router,1.0,"This function includes another `APIRouter` instance into the current one, allowing for nested routing and organization of API endpoints.",
tier4_008_run,1.0,This function rewrites assert statements in a given Python module by inserting special imports at the top of the module and transforming the original assert statements to use these new imports.,
tier4_009_construct_params,1.0,"This function constructs a dictionary of bind parameter keys and values for a SQL query, taking into account various parameters such as escaped names, required values, and callable parameters.",
tier4_010__getini_toml,1.0,"This function validates and processes TOML configuration values with strict type validation, ensuring that the provided value matches the expected type exactly, including list items, without any coercion or conversion.",
tier4_011__dataclass_schema,1.0,"This function generates a Pydantic dataclass schema, which is a JSON representation of the structure and validation rules for a Python class that conforms to the Pydantic dataclass specification.",
tier4_012_Field,1.0,"This function creates a field for objects that can be configured, allowing users to provide extra information about the field, such as its default value, alias, and validation rules.",
tier4_013___init__,1.0,"This function initializes a new SQLCompiler object, which is used to compile and execute SQL statements, by setting various attributes such as dialect, statement, cache key, column keys, and others.",
tier4_014_parametrize,1.0,"This function, `parametrize`, is a decorator that allows a test function to be executed multiple times with different sets of arguments, enabling the testing of multiple scenarios or edge cases in a single test.",
tier4_015__exec_single_context,1.0,"This function executes a SQL statement or multiple statements on a database connection, handling various parameters such as input sizes, caching, and event dispatching for different dialects.",
tier4_016_app,1.0,"This function is the main entry point for a FastAPI application, responsible for handling incoming HTTP requests and returning responses.",
tier4_017_visit_delete,1.0,"This function generates the SQL code for a DELETE statement, including any necessary prefixes, table clause, and additional clauses such as WHERE or RETURNING statements.",
tier4_018_visit_select,1.0,"This function generates the SQL code for a SELECT statement by parsing and processing the given SELECT object, including translating it to meet specific database requirements (e.g., LIMIT/OFFSET), handling compound queries with CTEs, and assembling the final SQL string.",
tier4_019__typed_dict_schema,1.0,"This function generates a core schema for a TypedDict class in Pydantic, which is used to validate and serialize data types that are defined using the `typing.TypedDict` syntax.",
tier4_020__match_generic_type,1.0,"This function attempts to determine the schema for a given object `obj` of type `origin`, by recursively checking various types and returning the corresponding schema, or an unknown schema if none match.",
tier4_021_get,1.0,"This function handles HTTP GET requests by retrieving the requested file or resource from a server, optionally returning only a portion of it (e.g., for partial content), and setting various headers to provide metadata about the response.",
tier4_022__process_parameters_for_postcompile,1.0,"This function processes special post-compile parameters in a SQL statement, handling expanding parameters, literal binds, and other edge cases to generate an expanded state for the statement.",
tier4_023_jsonable_encoder,1.0,"This function, `jsonable_encoder`, converts any object to a format that can be encoded in JSON, allowing it to be safely sent over the network or stored in a database.",
tier4_024_solve_dependencies,1.0,"This function, `solve_dependencies`, is a recursive asynchronous function that resolves dependencies in an application by calling sub-dependencies and handling their results, caching, and other parameters to ultimately return a solved dependency with its values, errors, background tasks, response, and cache.",
tier4_025__start_tls_connection,1.0,This function establishes a secure connection to a remote server using Transport Layer Security (TLS) by wrapping an existing TCP transport with a new TLS protocol.,
